,date,heading,link,image
0,"Wednesday, 23 February 2022",Biden imposes sanctions on company behind Nord Stream 2 gas pipeline – as it happened,https://www.theguardian.com/us-news/live/2022/feb/23/biden-ukraine-russia-crisis-putin-trump-republicans-politics-latest-live,https://i.guim.co.uk/img/media/cf521f0cc79f03f93d7b2e7846a98c9d103047e3/0_400_6000_3600/master/6000.jpg?width=300&quality=85&auto=format&fit=max&s=7d17283140326d515d5cb26c62e1791a
1,"Wednesday, 23 February 2022",Putin’s looming threat gives Johnson some breathing space,https://www.theguardian.com/politics/2022/feb/23/putins-looming-threat-gives-johnson-some-breathing-space,
2,"Wednesday, 23 February 2022",From ‘Putin’s chef’ to the RT editor: names expected to appear on EU sanctions list,https://www.theguardian.com/world/2022/feb/23/from-putins-chef-to-the-rt-editor-names-expected-to-appear-on-eu-sanctions-list,https://i.guim.co.uk/img/media/050c522ae5cc5e3e940692bbf0ef664bdadd34f2/0_13_4590_2753/master/4590.jpg?width=300&quality=85&auto=format&fit=max&s=bf48f8e32d7263e332703b46de24aad5
3,"Wednesday, 23 February 2022",Martin Rowson on Russian donors to the Tory party — cartoon,https://www.theguardian.com/commentisfree/picture/2022/feb/23/martin-rowson-on-russian-donors-to-the-tory-party-cartoon,https://i.guim.co.uk/img/media/4e76cd7e65bb82fd5d8a1e44258dddfb95e7911f/0_44_4866_2919/master/4866.jpg?width=300&quality=85&auto=format&fit=max&s=cfa944af8eb1d4a94808b22700280bed
4,"Wednesday, 23 February 2022",EU approves wide-ranging sanctions against Russia over Ukraine,https://www.theguardian.com/world/2022/feb/23/eu-poised-to-announce-wide-ranging-sanctions-on-russia-over-ukraine,
5,"Wednesday, 23 February 2022",Keir Starmer urges Boris Johnson to end ‘era of oligarch impunity’ – as it happened,https://www.theguardian.com/politics/live/2022/feb/23/uk-politics-live-boris-johnson-ukraine-russia-pmqs-latest-updates,
6,"Wednesday, 23 February 2022",Fighting the threat from Putin will take teamwork. But who trusts Johnson’s Britain?,https://www.theguardian.com/commentisfree/2022/feb/23/europe-vladimir-putin-boris-johnson-ukraine-britain,
7,"Wednesday, 23 February 2022",Ukrainians in UK making plans to return home to take up arms,https://www.theguardian.com/world/2022/feb/23/ukrainians-in-uk-making-plans-to-return-home-to-take-up-arms,
8,"Wednesday, 23 February 2022",What steps should Britain take to avert war in Ukraine?,https://www.theguardian.com/world/2022/feb/23/what-steps-should-britain-take-to-avert-war-in-ukraine,
9,"Wednesday, 23 February 2022",Understanding Putin’s narrative about Ukraine is the master key to this crisis,https://www.theguardian.com/commentisfree/2022/feb/23/putin-narrative-ukraine-master-key-crisis-nato-expansionism-frozen-conflict,
10,"Wednesday, 23 February 2022",Business brisk at Kyiv gun shops as Ukrainians rush to buy arms,https://www.theguardian.com/world/2022/feb/23/business-brisk-at-kyiv-gun-shops-as-ukrainians-rush-to-buy-arms,
11,"Wednesday, 23 February 2022","Europe could see out winter on gas reserves if Russian imports stop, says German analysis",https://www.theguardian.com/world/2022/feb/23/europe-winter-gas-reserves-russian-imports-german-analysis-ukraine,
12,"Wednesday, 23 February 2022",UK firms warned of Russian cyberwar ‘spillover’ from Ukraine,https://www.theguardian.com/technology/2022/feb/23/uk-firms-warned-russia-cyberwar-spillover-ukraine-critical-infrastructure,
13,"Wednesday, 23 February 2022",The brave woman who symbolises Ukraine: Mark Neville’s best photograph,https://www.theguardian.com/artanddesign/2022/feb/23/brave-woman-symbolises-ukraine-mark-nevilles-best-photograph-kremlin-falsehoods,
14,"Wednesday, 23 February 2022",Bank of England chief urges banks to show restraint on bonuses; global stocks recover – as it happened,https://www.theguardian.com/business/live/2022/feb/23/imf-talk-ukraine-aid-disbursement-markets-tense-business-live,
15,"Wednesday, 23 February 2022",Trump praises ‘genius’ Putin for moving troops to eastern Ukraine,https://www.theguardian.com/us-news/2022/feb/23/trump-putin-genius-russia-ukraine-crisis,
16,"Wednesday, 23 February 2022","UK 'out in front' in imposing sanctions on Russia, says Boris Johnson – video",https://www.theguardian.com/world/video/2022/feb/23/uk-out-in-front-in-imposing-sanctions-on-russia-says-boris-johnson-video,
17,"Wednesday, 23 February 2022","Russian TV broadcasts in UK a ‘disinformation campaign’, says Dorries",https://www.theguardian.com/politics/2022/feb/23/russian-tv-broadcasts-in-uk-a-disinformation-campaign-says-dorries,
18,"Wednesday, 23 February 2022",Forget the obsession with sanctions against oligarchs. I have a better way to hurt Putin,https://www.theguardian.com/commentisfree/2022/feb/23/obsession-sanctions-oligarchs-putin-hurt-russian-leader-ukraine,
19,"Wednesday, 23 February 2022",Truss rejects claim Russia-linked Tory donations influenced sanctions policy  – video,https://www.theguardian.com/politics/video/2022/feb/23/truss-rejects-claim-russia-linked-tory-donations-influenced-sanctions-policy-video,
20,"Wednesday, 23 February 2022","UK will stop Russia selling sovereign debt in London, says Liz Truss",https://www.theguardian.com/world/2022/feb/23/uk-russia-ukraine-liz-truss,
21,"Wednesday, 23 February 2022","Russia open to diplomacy on Ukraine, says Putin – video",https://www.theguardian.com/world/video/2022/feb/23/russia-open-to-diplomacy-on-ukraine-says-putin-video,
22,"Wednesday, 23 February 2022",Hidden cache – Inside the 25 February Guardian Weekly,https://www.theguardian.com/news/2022/feb/23/hidden-cache-inside-the-25-february-guardian-weekly,
23,"Wednesday, 23 February 2022",Scott Morrison speaks to Ukraine PM; 60 Covid deaths reported – as it happened,https://www.theguardian.com/australia-news/live/2022/feb/23/australia-news-updates-live-ukraine-scott-morrison-weather-coronavirus-covid-omicron-nsw-victoria-queensland-weather,
24,"Wednesday, 23 February 2022",Australian sanctions on Russia: who do they target and will they have an impact?,https://www.theguardian.com/australia-news/2022/feb/23/australian-sanctions-on-russia-who-do-they-target-and-will-they-have-an-impact,
25,"Wednesday, 23 February 2022",Australia imposes sanctions on Russia in response to Ukraine crisis,https://www.theguardian.com/australia-news/2022/feb/23/australia-imposes-sanctions-on-russia-in-response-to-ukraine-crisis,
26,"Wednesday, 23 February 2022",Ukraine president calls up reservists as sanctions coalition against Russia grows,https://www.theguardian.com/world/2022/feb/23/ukraine-president-calls-up-reservists-as-russia-moves-troops-into-countrys-east,
27,"Wednesday, 23 February 2022",Harsh conditions mean Russian troops near Ukraine will need to be moved soon,https://www.theguardian.com/world/2022/feb/23/harsh-conditions-mean-russian-troops-near-ukraine-will-need-to-be-moved-soon,
28,"Wednesday, 23 February 2022",Ukrainians ready for resistance: ‘The whole country will be fighting back’,https://www.theguardian.com/world/2022/feb/23/ukrainians-ready-for-resistance-the-whole-country-will-be-fighting-back,
29,"Wednesday, 23 February 2022","US, UK and European sanctions target Russian economy and oligarchs – as it happened",https://www.theguardian.com/world/live/2022/feb/22/ukraine-russia-latest-live-news-updates-crisis-putin-biden-zelenskiy-kyiv-kiev-russian-invasion-border-threat,
30,"Wednesday, 23 February 2022",Australian prime minister Scott Morrison says Russia acting like 'thugs' over Ukraine – video,https://www.theguardian.com/world/video/2022/feb/23/australian-prime-minister-scott-morrison-says-russia-acting-like-thugs-over-ukraine-video,
31,"Wednesday, 23 February 2022",Can anything stop Putin’s advance into Ukraine?,https://www.theguardian.com/australia-news/audio/2022/feb/23/can-anything-stop-putins-advance-into-ukraine,
32,"Wednesday, 23 February 2022",‘Grab him by the roubles’: How the papers covered the threat of war in Ukraine,https://www.theguardian.com/media/2022/feb/23/grab-him-by-the-roubles-how-the-papers-covered-the-threat-of-war-in-ukraine,
33,"Wednesday, 23 February 2022",Putin orders troops into Ukraine. Now what?,https://www.theguardian.com/news/audio/2022/feb/23/putin-orders-troops-into-ukraine-now-what-podcast,
34,"Wednesday, 23 February 2022",Biden’s Russia sanctions: why holding back could be part of his strategy,https://www.theguardian.com/us-news/2022/feb/22/joe-biden-russia-first-sanctions-ukraine-analysis,
35,"Thursday, 24 February 2022","‘Putin chose this war,’ Biden says as he announces new sanctions – US politics as it happened",https://www.theguardian.com/us-news/live/2022/feb/24/biden-ukraine-us-russia-invasion-latest-news-g7-leaders-updates,https://i.guim.co.uk/img/media/e1a7ea66167c89273960a25ff1e6d1955c4100fd/0_0_5019_3012/master/5019.jpg?width=300&quality=85&auto=format&fit=max&s=6df6c3e44e27aa24473beec7eff87461
36,"Thursday, 24 February 2022",Russian anti-war protesters face police crackdown and arrests – video,https://www.theguardian.com/world/video/2022/feb/25/russian-anti-war-protesters-face-police-crackdown-and-arrests-video,https://i.guim.co.uk/img/media/68ee5cfce869cddf9276e524aa538a6551a710a7/0_88_6962_4180/master/6962.jpg?width=300&quality=85&auto=format&fit=max&s=d309575024b5f5ccd46d120d8d56b5f5
37,"Thursday, 24 February 2022",Why has Putin’s Russia waged war on Ukraine? – video explainer,https://www.theguardian.com/world/video/2022/feb/24/why-has-putins-russia-waged-war-on-ukraine-video-explainer,https://i.guim.co.uk/img/media/869b008f7af62983fb6b2c078fe6175222adcf16/60_0_1800_1080/master/1800.jpg?width=300&quality=85&auto=format&fit=max&s=dfcfe83d38413012c876815f9f2e303c
38,"Thursday, 24 February 2022",Boris Johnson says ‘Putin must fail’ after Cobra meeting – as it happened,https://www.theguardian.com/politics/live/2022/feb/24/uk-politics-live-boris-johnson-sanctions-russia-invasion-ukraine-latest-updates,https://i.guim.co.uk/img/media/b87bdaf80a358cfb2787936916be9dfd1ddba8fd/110_0_3457_2074/master/3457.jpg?width=300&quality=85&auto=format&fit=max&s=1a464819bafef0171530e119c1e26f3c
39,"Thursday, 24 February 2022",Russia invades Ukraine,https://www.theguardian.com/politics/audio/2022/feb/24/russia-invades-ukraine-podcast,
40,"Thursday, 24 February 2022",Biden’s Russia warnings come to pass – what does the US president do now?,https://www.theguardian.com/us-news/2022/feb/24/biden-ukraine-russia-republicans-democrats-us-politics,
41,"Thursday, 24 February 2022",Video appears to show military vehicles at Chernobyl – video,https://www.theguardian.com/environment/video/2022/feb/24/video-appears-to-show-military-vehicles-at-chernobyl-video,
42,"Thursday, 24 February 2022","Russia unleashed data-wiper malware on Ukraine, say cyber experts",https://www.theguardian.com/world/2022/feb/24/russia-unleashed-data-wiper-virus-on-ukraine-say-cyber-experts,
43,"Thursday, 24 February 2022",Biden imposes new sanctions on Russia: ‘America stands up to bullies’,https://www.theguardian.com/us-news/2022/feb/24/joe-biden-us-russia-sanctions-ukraine,
44,"Thursday, 24 February 2022",'Putin will bear the consequences’: Biden addresses Russia's invasion of Ukraine – video,https://www.theguardian.com/world/video/2022/feb/24/putin-will-bear-the-consequences-biden-addresses-russias-invasion-of-ukraine-video,
45,"Thursday, 24 February 2022",Ukraine fights for its survival as Putin presses forward,https://www.theguardian.com/world/2022/feb/24/ukraine-fights-for-its-survival-as-putin-presses-forward,
46,"Thursday, 24 February 2022",US and UK intelligence warnings vindicated by Russian invasion,https://www.theguardian.com/us-news/2022/feb/24/us-uk-intelligence-russian-invasion-ukraine,
47,"Thursday, 24 February 2022",Sean Penn in Ukraine to film documentary on Russian invasion,https://www.theguardian.com/film/2022/feb/24/sean-penn-ukraine-documentary-russian-invasion,
48,"Thursday, 24 February 2022",‘A knot in my stomach’: Canada’s Ukrainian community shaken by Russia invasion,https://www.theguardian.com/world/2022/feb/24/canada-ukrainian-community-russia-invasion,
49,"Thursday, 24 February 2022",Russia has invaded Ukraine: what we know so far,https://www.theguardian.com/world/2022/feb/24/russia-has-invaded-ukraine-what-we-know-so-far,
50,"Thursday, 24 February 2022","Compared with Putin, Boris Johnson is a sociopath we can accept",https://www.theguardian.com/politics/2022/feb/24/compared-with-putin-boris-johnson-is-a-sociopath-we-can-accept,
51,"Thursday, 24 February 2022",Steve Bell on the US and UK response to Russia’s invasion of Ukraine – cartoon,https://www.theguardian.com/commentisfree/picture/2022/feb/24/steve-bell-on-the-us-and-uk-response-to-russias-invasion-of-ukraine-cartoon,
52,"Thursday, 24 February 2022",War in Ukraine: where has Russia attacked?,https://www.theguardian.com/world/2022/feb/24/war-ukraine-kyiv-map-where-has-russia-attacked,
53,"Thursday, 24 February 2022",Boris Johnson announces ‘largest ever’ set of sanctions against Russia,https://www.theguardian.com/world/2022/feb/24/boris-johnson-announces-largest-ever-set-of-sanctions-against-russia,
54,"Thursday, 24 February 2022",CNN reporter encounters Russian troops during live Kyiv dispatch – video,https://www.theguardian.com/world/video/2022/feb/24/cnn-reporter-encounters-russian-troops-during-live-kyiv-dispatch-video,
55,"Thursday, 24 February 2022",Thousands join anti-war protests in Russia after Ukraine invasion,https://www.theguardian.com/world/2022/feb/24/we-dont-want-this-russians-react-to-the-ukraine-invasion,
56,"Thursday, 24 February 2022",Airstrikes at dawn as Russia begins ‘war of aggression’ with Ukraine,https://www.theguardian.com/world/2022/feb/24/airstrikes-dawn-russia-begins-war-aggression-with-ukraine-vladimir-putin,
57,"Thursday, 24 February 2022",Labour MPs drop backing for statement criticising Nato after Starmer warning,https://www.theguardian.com/politics/2022/feb/24/labour-mps-drop-backing-for-statement-criticising-nato-after-starmer-warning,
58,"Thursday, 24 February 2022",Thousands of Ukrainians flee country after Russian invasion,https://www.theguardian.com/world/2022/feb/24/ukraine-russia-flee-country-invasion,
59,"Thursday, 24 February 2022",Footage shows Russian helicopters engaging with forces in Ukraine – video,https://www.theguardian.com/world/video/2022/feb/24/footage-shows-russian-helicopters-engaging-with-forces-in-ukraine-video,
60,"Thursday, 24 February 2022",The Guardian view on Putin’s war in Ukraine: a bleak new beginning,https://www.theguardian.com/commentisfree/2022/feb/24/the-guardian-view-on-putins-war-in-ukraine-a-bleak-new-beginning,
61,"Thursday, 24 February 2022",The Guardian view on Britain and Ukraine: play our part,https://www.theguardian.com/commentisfree/2022/feb/24/the-guardian-view-on-britain-and-ukraine-play-our-part,
62,"Thursday, 24 February 2022",'I don't want to leave': Ukrainians record messages from their cars as they flee war – video,https://www.theguardian.com/world/video/2022/feb/24/i-dont-want-to-leave-ukrainians-record-messages-from-their-cars-as-they-flee-war-video,
63,"Thursday, 24 February 2022",Kyiv furious as EU fails to block Russia from Swift payment system,https://www.theguardian.com/world/2022/feb/24/kyiv-furious-as-eu-wavers-on-banning-russia-from-swift-payment-system,
64,"Thursday, 24 February 2022",UK accused of being ‘toothless’ in sanctions enforcement,https://www.theguardian.com/politics/2022/feb/24/uk-sanctions-enforcement-toothless-russia-deterrent,
65,"Thursday, 24 February 2022",Ukraine fighting to stop ‘a new iron curtain’ after Russian invasion,https://www.theguardian.com/world/2022/feb/24/russia-attacks-ukraine-news-vladimir-putin-zelenskiy-russian-invasion,
66,"Thursday, 24 February 2022",Russian central bank steps in to prop up rouble and avert market collapse,https://www.theguardian.com/business/2022/feb/24/russian-central-bank-buys-up-roubles-to-avert-stock-market-collapse-invasion-ukraine-fiancial-meltdown,
67,"Thursday, 24 February 2022",Living near Ukraine? Share your thoughts on the situation,https://www.theguardian.com/world/2022/feb/24/living-near-ukraine-share-your-thoughts-on-the-situation,
68,"Thursday, 24 February 2022",Putin’s attack on Ukraine isn’t just about Europe. We must rally the world against this act of war,https://www.theguardian.com/commentisfree/2022/feb/24/sanctions-defeat-putin-authoritarian-ideology-russia-ukraine,
69,"Thursday, 24 February 2022",‘I will not go’: Vettel calls on F1 to scrap Russian GP after Ukraine invasion,https://www.theguardian.com/sport/2022/feb/24/f1-russian-grand-prix-remains-on-calendar-despite-invasion-of-ukraine,
70,"Thursday, 24 February 2022",Ukraine crisis: commodities prices surge as stock markets slump,https://www.theguardian.com/business/2022/feb/24/gas-and-oil-prices-surge-amid-fears-of-global-energy-shortage-russia-ukraine,
71,"Thursday, 24 February 2022",Russia’s invasion of Ukraine will change the face of Europe for ever,https://www.theguardian.com/commentisfree/2022/feb/24/russia-invasion-ukraine-europe-ukrainians,
72,"Thursday, 24 February 2022",Two former European prime ministers quit boards of Russian companies,https://www.theguardian.com/business/2022/feb/24/two-former-european-prime-ministers-quit-boards-of-russian-companies,
73,"Thursday, 24 February 2022","Average UK energy bills could hit £3,000 a year, consumers warned",https://www.theguardian.com/money/2022/feb/24/average-uk-energy-bill-could-hit-2600-year-consumer-warned-russian-invasion-ukraine,
74,"Thursday, 24 February 2022","Oil jumps to $105, gas prices surge and global stocks tumble after Ukraine invasion – as it happened",https://www.theguardian.com/business/live/2022/feb/24/oil-prices-rise-100-global-stock-markets-plunge-russia-invades-ukraine-business-live,
75,"Thursday, 24 February 2022",Ukrainians protest at Downing Street gates over Russian invasion,https://www.theguardian.com/uk-news/2022/feb/24/ukrainians-protest-at-downing-street-gates-over-russian-invasion-uk-military-sanctions,
76,"Thursday, 24 February 2022",Can anyone in Russia stop Putin now?,https://www.theguardian.com/commentisfree/2022/feb/24/ukraine-russia-vladimir-putin-kremlin,
77,"Thursday, 24 February 2022",Eight sobering realities about Putin’s invasion of Ukraine,https://www.theguardian.com/commentisfree/2022/feb/24/russia-putin-invasion-ukraine-robert-reich,
78,"Thursday, 24 February 2022",What can the west do about Russia invading Ukraine?,https://www.theguardian.com/world/2022/feb/24/russia-invading-ukraine-putin-nato-what-can-west-do,
79,"Thursday, 24 February 2022",How will Russia’s assault on Ukraine affect UK gas supplies?,https://www.theguardian.com/business/2022/feb/24/how-will-russia-assault-ukraine-affect-uk-gas-supplies,
80,"Thursday, 24 February 2022","Russia-backed hackers behind powerful new malware, UK and US say",https://www.theguardian.com/world/2022/feb/23/russia-hacking-malware-cyberattack-virus-ukraine,
81,"Friday, 25 February 2022",Video of Ukrainian ‘tank man’ trying to block Russian military convoy goes viral,https://www.theguardian.com/world/2022/feb/25/ukraine-tank-man-video-clip,https://i.guim.co.uk/img/media/09acb0bfefd373a958ec3863cd05864422a63344/0_153_1208_724/master/1208.jpg?width=300&quality=85&auto=format&fit=max&s=834c004cd55f1073c3852567d8c5c479
82,"Friday, 25 February 2022",Russian forces tighten hold on Kyiv in attempt to topple government,https://www.theguardian.com/world/2022/feb/25/kyiv-attack-latest-russia-invasion-ukraine,https://i.guim.co.uk/img/media/a00844181fa7695e7ae291c0ad90f54aed563698/0_152_2736_1642/master/2736.jpg?width=300&quality=85&auto=format&fit=max&s=915babd788841663cdbc94b3f4d60cdc
83,"Friday, 25 February 2022",UK politics live: Boris Johnson imposes sanctions against Putin and Lavrov – as it happened,https://www.theguardian.com/politics/live/2022/feb/25/uk-politics-live-boris-johnson-russia-invasion-ukraine-latest-updates,https://i.guim.co.uk/img/media/0e7e128b22542b8bde379498c7602afa96943e73/0_117_5184_3110/master/5184.jpg?width=300&quality=85&auto=format&fit=max&s=5b0bf0e4dcf578e3e6076f2511532772
84,"Friday, 25 February 2022",Everton to silence air-raid siren out of respect for Ukraine internationals,https://www.theguardian.com/football/2022/feb/25/everton-to-silence-air-raid-siren-out-of-respect-for-ukraine-internationals,https://i.guim.co.uk/img/media/6a305c2a59e98c77e431579feab68afa27280453/0_0_2560_1536/master/2560.jpg?width=300&quality=85&auto=format&fit=max&s=f2371b1a4babd70bbee737b09c2c6eae
85,"Friday, 25 February 2022",Fears mount for safety of Ukraine’s nuclear reactors amid Russian invasion,https://www.theguardian.com/world/2022/feb/25/nuclear-meltdown-threat-ukraine-russia-attack,
86,"Friday, 25 February 2022",Putin references neo-Nazis and drug addicts in bizarre speech to Russian security council – video,https://www.theguardian.com/world/video/2022/feb/25/putin-references-neo-nazis-and-drug-addicts-in-bizarre-speech-to-russian-security-council-video,
87,"Friday, 25 February 2022",Zelenskiy tells Ukrainians he will remain in Kyiv – video,https://www.theguardian.com/world/video/2022/feb/25/zelenskiy-tells-ukrainians-he-will-remain-in-kyiv-video,
88,"Friday, 25 February 2022",Martin Rowson on the frightening rise of Vladimir Putin – cartoon,https://www.theguardian.com/commentisfree/picture/2022/feb/25/martin-rowson-on-the-frightening-rise-of-vladimir-putin-cartoon,
89,"Friday, 25 February 2022",Ukrainian man survives after military vehicle swerves and drives over his car – video,https://www.theguardian.com/world/video/2022/feb/25/ukrainian-man-survives-after-military-vehicle-swerves-and-drives-over-his-car-video,
90,"Friday, 25 February 2022",‘It’s not rational’: Putin’s bizarre speech wrecks his once pragmatic image,https://www.theguardian.com/world/2022/feb/25/its-not-rational-putins-bizarre-speech-wrecks-his-once-pragmatic-image,
91,"Friday, 25 February 2022",BP’s ties to Russia draw UK government ‘concern’,https://www.theguardian.com/business/2022/feb/25/bps-ties-to-russia-draw-uk-government-concern,
92,"Friday, 25 February 2022",Australian grain prices set to rise as Russian invasion of Ukraine disrupts global supplies,https://www.theguardian.com/australia-news/2022/feb/26/australian-grain-prices-set-to-rise-as-russian-invasion-of-ukraine-disrupts-global-supplies,
93,"Friday, 25 February 2022","From a China frenzy to casual transphobia, PM is on the hunt for disaffected but highly motivated voters",https://www.theguardian.com/australia-news/2022/feb/26/from-a-china-frenzy-to-casual-transphobia-pm-is-on-the-hunt-for-disaffected-but-highly-motivated-voters,
94,"Friday, 25 February 2022",Nato to deploy extra troops to alliance nations in eastern Europe,https://www.theguardian.com/world/2022/feb/25/nato-deploy-extra-troops-eastern-europe-ukraine-russia-war,
95,"Friday, 25 February 2022",Where has fighting been focused on day two of Russia’s invasion of Ukraine?,https://www.theguardian.com/world/2022/feb/25/fight-for-kyiv-russian-forces-ukraine-capital-war,
96,"Friday, 25 February 2022",Newborn babies moved to bomb shelter from hospital in eastern Ukraine – video,https://www.theguardian.com/world/video/2022/feb/25/newborn-babies-moved-to-bomb-shelter-from-hospital-in-eastern-ukraine-video,
97,"Friday, 25 February 2022",Charities and opposition parties urge UK to do more for Ukrainian refugees,https://www.theguardian.com/world/2022/feb/25/charities-and-opposition-parties-urge-uk-to-do-more-for-ukrainian-refugees,
98,"Friday, 25 February 2022","The Guardian view on Putin’s Ukraine war: promoting bloodshed, not ending it",https://www.theguardian.com/commentisfree/2022/feb/25/the-guardian-view-on-putins-ukraine-war-promoting-bloodshed-not-ending-it,
99,"Friday, 25 February 2022","I’m Russian, but Ukraine is close to my heart. What on earth are we doing?",https://www.theguardian.com/commentisfree/2022/feb/25/family-russia-ukraine-fear-both-sides-of-border,
100,"Friday, 25 February 2022","EU, US, UK and Canada announce sanctions targeting Vladimir Putin and Sergei Lavrov",https://www.theguardian.com/world/2022/feb/25/eu-to-announce-sanctions-targeting-vladimir-putin-and-sergei-lavrov,
101,"Friday, 25 February 2022",Global markets surge as concerns ease over effect of sanctions on the west,https://www.theguardian.com/business/2022/feb/25/global-markets-surge-as-concerns-ease-over-effect-of-sanctions-on-the-west,
102,"Friday, 25 February 2022","'We are defending our country alone,' Zelenskiy tells Ukrainians as Russia approaches Kyiv – video",https://www.theguardian.com/world/video/2022/feb/25/we-are-defending-our-country-alone-zelenskiy-tells-ukrainians-as-russia-approaches-kyiv-video,
103,"Friday, 25 February 2022",The battle for Kyiv: ‘People are grieving. This is already a tragedy’,https://www.theguardian.com/world/2022/feb/25/battle-for-kyiv-people-grieving-already-tragedy-ukraine-invasion,
104,"Friday, 25 February 2022",Russia partially restricts access to Facebook to ‘protect Russian media’,https://www.theguardian.com/world/2022/feb/24/ukraine-hackers-defend-against-russia,
105,"Friday, 25 February 2022",‘Terrible and fantastical’: fear and farewells on the road out of Ukraine,https://www.theguardian.com/world/2022/feb/25/terrible-and-fantastical-fear-and-farewells-on-the-road-out-of-ukraine-kyiv-russia,
106,"Friday, 25 February 2022",British nationals fear permanent separation from Ukrainian family,https://www.theguardian.com/world/2022/feb/25/british-nationals-fear-permanent-separation-from-ukraine-family-russia,
107,"Friday, 25 February 2022",Russia is banned from Eurovision after invasion of Ukraine,https://www.theguardian.com/tv-and-radio/2022/feb/25/russia-banned-from-eurovision-after-invasion-of-ukraine,
