,date,heading,link,image
440,"Friday, 4 March 2022",‘Putin wants to kill us totally’: Ukrainians hold firm under bombardment,https://www.theguardian.com/world/2022/mar/04/putin-wants-to-kill-us-totally-ukrainians-hold-firm-under-bombardment,
441,"Friday, 4 March 2022",A beloved New York restaurant becomes place of unity for Ukraine,https://www.theguardian.com/us-news/2022/mar/04/veselka-beloved-new-york-restaurant-rallying-spot-ukraine,
442,"Friday, 4 March 2022",Russia steps up onslaught after Ukraine ‘narrowly’ escapes nuclear disaster,https://www.theguardian.com/world/2022/mar/04/nato-chief-warns-of-worse-suffering-in-ukraine-and-russian-attacks-elsewhere,
443,"Friday, 4 March 2022",‘Tip of the iceberg’: Berliners rally to welcome refugees from Ukraine,https://www.theguardian.com/world/2022/mar/04/berliners-rally-to-support-ukraine-refugees-germany,
444,"Friday, 4 March 2022","Fire, rubble and ruins in Chernihiv after Russian strike – video",https://www.theguardian.com/world/video/2022/mar/04/fire-rubble-and-ruins-in-chernihiv-after-russian-strike-video,
445,"Friday, 4 March 2022",Ukraine backs international tribunal plan to try Putin for crime of aggression,https://www.theguardian.com/world/2022/mar/04/ukraine-backs-plan-for-international-tribunal-to-try-putin-for-of-aggression,
446,"Friday, 4 March 2022",‘90% of houses are damaged’: Russia’s Syria-honed tactics lay waste Ukraine towns,https://www.theguardian.com/world/2022/mar/04/ninety-per-cent-of-houses-are-damaged-thousands-trapped-in-ukraines-small-towns,
447,"Friday, 4 March 2022",War in Ukraine: what we know on day nine of the Russian invasion,https://www.theguardian.com/world/2022/mar/04/war-in-ukraine-what-we-know-on-day-nine-of-the-russian-invasion,
448,"Friday, 4 March 2022",Pentagon sets up hotline with Russia to avert Ukraine ‘miscalculation’,https://www.theguardian.com/us-news/2022/mar/04/pentagon-hotline-russia-ukraine-miscalculation,
449,"Saturday, 5 March 2022",Visa and Mastercard will both suspend operations in Russia,https://www.theguardian.com/world/2022/mar/05/visa-and-mastercard-will-both-suspend-operations-in-russia,https://i.guim.co.uk/img/media/dca7943ecac01d1f69fd0e033c4fc2dcc19cccf1/0_270_4000_2400/master/4000.jpg?width=300&quality=85&auto=format&fit=max&s=c1220173b0643c59b126c32d7ec5b448
450,"Saturday, 5 March 2022",Defiant Putin warns the west: your sanctions are akin to an act of war,https://www.theguardian.com/world/2022/mar/05/defiant-putin-warns-the-west-your-sanctions-are-akin-to-an-act-of-war,https://i.guim.co.uk/img/media/a46ea9b415630d55708fbed1de862c4d2e4e25aa/0_75_6001_3601/master/6001.jpg?width=300&quality=85&auto=format&fit=max&s=82553bf0950d2b4ab83549def21791e8
451,"Saturday, 5 March 2022",Dmytro Kuleba: 'Ukraine is bleeding but has not fallen' – video,https://www.theguardian.com/world/video/2022/mar/05/dmytro-kuleba-ukraine-is-bleeding-but-has-not-fallen-video,https://i.guim.co.uk/img/media/842392d399988275dbca2ecd723bb1c8da3acb3a/120_0_1800_1080/master/1800.jpg?width=300&quality=85&auto=format&fit=max&s=dfd64bf7c3c242dd720e4c03afe64015
452,"Saturday, 5 March 2022",Zelenskiy calls for US to send aircraft to Ukraine in video call with US Congress,https://www.theguardian.com/us-news/2022/mar/05/ukraine-us-congress-zelenskiy-video-call,https://i.guim.co.uk/img/media/79bc4a8eff1d98e1f2b9b3871125a4d64daa4321/0_188_2208_1324/master/2208.jpg?width=300&quality=85&auto=format&fit=max&s=8c2c8a7712e93862467cfe6376df6427
453,"Saturday, 5 March 2022",Premier League fans and clubs show support for Ukraine – video,https://www.theguardian.com/football/video/2022/mar/05/premier-league-fans-and-clubs-show-support-for-ukraine-video,
454,"Saturday, 5 March 2022",English football’s messages of support to Ukraine – in pictures,https://www.theguardian.com/world/gallery/2022/mar/05/english-football-ukraine-support-premier-league-in-pictures,
455,"Saturday, 5 March 2022",Far right and far left alike admired Putin. Now we’ve all turned against strongmen,https://www.theguardian.com/commentisfree/2022/mar/05/far-right-far-left-admired-putin-weve-all-turned-against-strongmen,
456,"Saturday, 5 March 2022",Vladimir Putin: a miracle defender of Christianity or the most evil man?,https://www.theguardian.com/commentisfree/2022/mar/06/vladimir-putin-a-miracle-defender-of-christianity-or-the-most-evil-man,
457,"Saturday, 5 March 2022","As civilians leave, fortress Kyiv grimly prepares for Russian advance",https://www.theguardian.com/world/2022/mar/05/fortress-kyiv-ukraine-grimly-anticipates-russia-advance,
458,"Saturday, 5 March 2022",‘Show respect’: Thomas Tuchel hits out at Chelsea fans for Abramovich chant,https://www.theguardian.com/football/2022/mar/05/show-some-respect-tuchel-blasts-chelsea-fans-for-abramovich-chant,
459,"Saturday, 5 March 2022","Ukraine can win, says US, as fightback frustrates Putin’s plan for swift victory",https://www.theguardian.com/world/2022/mar/05/ukraine-claims-battlefield-successes-as-mariupol-evacuation-falls-apart-russia,
460,"Saturday, 5 March 2022",Ukraine: UN says more than 1.3 million have fled since Russian invasion began,https://www.theguardian.com/global-development/2022/mar/05/ukraine-un-says-more-than-13-million-have-fled-since-russian-invasion-began,
461,"Saturday, 5 March 2022","Vladimir Putin, war criminal – cartoon",https://www.theguardian.com/commentisfree/picture/2022/mar/05/vladimir-putin-war-criminal-cartoon,
462,"Saturday, 5 March 2022",Ukraine fundraiser hits £85m as charities say money needed more than goods,https://www.theguardian.com/society/2022/mar/05/ukraine-fundraiser-hits-85m-as-charities-say-money-needed-more-than-goods,
463,"Saturday, 5 March 2022","Britain’s Ukraine visa scheme is complex and unfair, say critics",https://www.theguardian.com/world/2022/mar/05/britains-ukraine-visa-scheme-is-complex-and-unfair-say-critics,
464,"Saturday, 5 March 2022",Mariupol evacuation postponed as Russia accused of breaking ceasefire,https://www.theguardian.com/world/2022/mar/05/zelenskiy-lashes-out-at-nato-over-no-fly-zone-as-russian-attacks-intensify,
465,"Saturday, 5 March 2022",Gunfire reportedly heard as Ukrainians rally in Kherson against Russia's occupation – video,https://www.theguardian.com/world/video/2022/mar/05/gunfire-reportedly-heard-as-ukrainians-rally-in-kherson-against-russias-occupation-video,
466,"Saturday, 5 March 2022",The week in audio: Paperless; Weekend; Ukrainecast; The Rest Is History – review,https://www.theguardian.com/tv-and-radio/2022/mar/05/paperless-podcast-review-ukrainecast-the-rest-is-history-the-rest-is-politics,
467,"Saturday, 5 March 2022","As 1.3 million people flee, Ukraine’s refugee crisis is only just beginning",https://www.theguardian.com/global-development/2022/mar/05/ukrainians-head-west-as-un-warns-refugee-crisis-is-only-just-beginning,
468,"Saturday, 5 March 2022",Telegram: the app at the heart of Ukraine’s propaganda battle,https://www.theguardian.com/business/2022/mar/05/telegram-app-ukraine-rides-high-thirst-trustworthy-news,
469,"Saturday, 5 March 2022",Russia’s central bank head ‘is mourning for her economy’,https://www.theguardian.com/business/2022/mar/05/russias-central-bank-head-is-mourning-for-her-economy,
470,"Saturday, 5 March 2022",Ukraine’s victories in the ‘TikTok war’ won’t stop Vlad the Invader’s missiles,https://www.theguardian.com/commentisfree/2022/mar/05/ukraines-victories-in-the-tiktok-war-wont-stop-vlad-the-invaders-missiles,
471,"Saturday, 5 March 2022",Boris Johnson praises ‘astonishing’ courage of UK journalists shot by Russian hit squad,https://www.theguardian.com/world/2022/mar/05/boris-johnson-praises-astonishing-courage-of-uk-journalists-shot-by-russian-hit-squad,
472,"Saturday, 5 March 2022",Zara owner Inditex ceases trading in Russia ‘temporarily’,https://www.theguardian.com/world/2022/mar/05/zara-owner-inditex-ceases-trading-in-russia-temporarily-ukraine-sanctions,
473,"Saturday, 5 March 2022",Germany agonises over Merkel’s legacy: did she hand too much power to Putin?,https://www.theguardian.com/world/2022/mar/05/germany-angela-merkel-power-to-vladimir-putin-russia,
474,"Saturday, 5 March 2022",Footage shows aftermath of Russian airstrike in Ukraine's Bila Tserkva – video,https://www.theguardian.com/world/video/2022/mar/05/footage-shows-aftermath-of-russian-air-strike-in-ukraines-bila-tserkva-video,
475,"Saturday, 5 March 2022",Russia-Ukraine war: what we know on day 10 of the Russian invasion,https://www.theguardian.com/world/2022/mar/05/russia-ukraine-war-what-we-know-on-day-ten-of-the-russian-invasion,
476,"Saturday, 5 March 2022","Russia fails to observe ceasefire in Mariupol and Volnovakha, say Ukrainian officials – video",https://www.theguardian.com/global/video/2022/mar/05/russia-fails-to-observe-ceasefire-in-mariupol-and-volnovakha-say-ukrainian-officials-video,
477,"Saturday, 5 March 2022",‘We understand what war means’: Poles rush to aid Ukraine’s refugees,https://www.theguardian.com/global-development/2022/mar/05/poland-rush-to-aid-ukraine-refugees-russia-war,
478,"Saturday, 5 March 2022","Be open, be honest and listen: how to talk to children about Ukraine",https://www.theguardian.com/society/2022/mar/05/be-open-be-honest-and-listen-how-to-talk-to-children-about-ukraine,
479,"Saturday, 5 March 2022","UK nationals should leave Russia while they can, Foreign Office says",https://www.theguardian.com/world/2022/mar/05/foreign-office-advises-non-essential-uk-nationals-to-leave-russia,
480,"Saturday, 5 March 2022","Italy seizes yachts and villas from Russian oligarchs, say state sources",https://www.theguardian.com/news/2022/mar/05/italy-seizes-yachts-and-villas-from-russian-oligarchs-say-state-sources-ukraine-invasion-sanctions,
481,"Saturday, 5 March 2022",Zelenskiy attacks Nato 'weakness' for refusing no-fly zone over Ukraine – video,https://www.theguardian.com/world/video/2022/mar/05/zelenskiy-attacks-nato-weakness-for-refusing-no-fly-zone-over-ukraine-video,
482,"Saturday, 5 March 2022",Ukraine claims footage shows them shooting down Russian military helicopter – video,https://www.theguardian.com/global/video/2022/mar/05/ukraine-claims-footage-shows-them-shooting-down-russian-military-helicopter-video,
483,"Saturday, 5 March 2022","The world is unpredictable and strange. Still, there is hope in the madness",https://www.theguardian.com/commentisfree/2022/mar/05/world-is-unpredictable-and-strange-climate-crisis-ukraine,
484,"Saturday, 5 March 2022",'I can't believe this is happening': the refugees trying to escape Ukraine – video,https://www.theguardian.com/world/video/2022/mar/05/i-cant-believe-this-is-happening-the-refugees-trying-to-escape-ukraine-video,
485,"Saturday, 5 March 2022",No-fly zones would escalate the Ukraine war – but they shouldn’t be off the table,https://www.theguardian.com/commentisfree/2022/mar/05/no-fly-zones-ukraine-war-escalation,
486,"Saturday, 5 March 2022",Q&A: Has the IPCC’s bleak warning of climate breakdown been heard?,https://www.theguardian.com/environment/2022/mar/05/qa-has-the-ipccs-bleak-warning-of-climate-breakdown-been-heard,
487,"Saturday, 5 March 2022",Ukraine crisis: how you can help from the UK by donating cash and supplies,https://www.theguardian.com/money/2022/mar/05/ukraine-crisis-how-you-can-help-donating-cash-supplies,
488,"Saturday, 5 March 2022","Ukraine refugees may struggle to find places in English schools, councils say",https://www.theguardian.com/education/2022/mar/05/ukraine-refugees-may-struggle-to-find-places-in-english-schools-councils-say,
489,"Saturday, 5 March 2022",War as seen on TikTok: Ukraine clips get views whether true or not,https://www.theguardian.com/technology/2022/mar/05/tiktok-ukraine-russia-invasion-clips-get-views-whether-true-or-not,
490,"Saturday, 5 March 2022",Streaming: the best Ukrainian films past and present,https://www.theguardian.com/film/2022/mar/05/streaming-best-films-ukraine-man-with-a-movie-camera-sergei-loznitsa,
491,"Saturday, 5 March 2022",We are haunted by ghosts – and Vladimir Putin’s sickly dreams,https://www.theguardian.com/commentisfree/2022/mar/05/vladimir-putin-ukraine,
492,"Saturday, 5 March 2022",UK’s vulnerability to corruption uncovered amid slow sanctions response,https://www.theguardian.com/commentisfree/2022/mar/05/uks-vulnerability-to-corruption-uncovered-amid-slow-sanctions-response,
493,"Saturday, 5 March 2022",‘Quite wrong’: David Miliband singles out UK’s visa policy on Ukrainian refugees,https://www.theguardian.com/world/2022/mar/05/quite-wrong-david-miliband-singles-out-uks-visa-policy-on-ukrainian-refugees,
494,"Saturday, 5 March 2022","Energy bills: British consumers quoted up to £3,500 a year for fixed rates",https://www.theguardian.com/money/2022/mar/05/fixed-rate-energy-deals-households-in-great-britain-quoted-up-to-3500-a-year,
495,"Sunday, 6 March 2022",‘Impossible’: Bolshoi music director quits over calls to denounce Ukraine invasion,https://www.theguardian.com/stage/2022/mar/07/impossible-bolshoi-music-director-tugan-sokhiev-quits-over-calls-to-denounce-ukraine-invasion,https://i.guim.co.uk/img/media/a6d25fe77bb94b7867a1e4313cc81a58677d6c91/0_1_6591_3955/master/6591.jpg?width=300&quality=85&auto=format&fit=max&s=8f43c10ecd6a1bf2221f58f5b16a644f
496,"Sunday, 6 March 2022",Johnson steps up Ukraine support but is accused of slowness on Russian dirty money,https://www.theguardian.com/politics/2022/mar/06/johnson-steps-up-ukraine-support-but-is-accused-of-slowness-on-russian-dirty-money,https://i.guim.co.uk/img/media/eee7c49fa55d90644443d7a4da0ca35e7b95b4c9/0_45_1863_1117/master/1863.jpg?width=300&quality=85&auto=format&fit=max&s=0ee5929fc768ec06e7effd6fd43f0da7
497,"Sunday, 6 March 2022",Denmark to hold referendum on scrapping EU defence opt-out,https://www.theguardian.com/world/2022/mar/06/denmark-to-hold-referendum-eu-defence-opt-out,https://i.guim.co.uk/img/media/07200e1f52a58437313ffae61621c023fb5b9970/0_210_4608_2765/master/4608.jpg?width=300&quality=85&auto=format&fit=max&s=5c837daedd81e19c5bd0e6102581a300
498,"Sunday, 6 March 2022",Flashmob orchestra in Trafalgar Square plays in solidarity with Ukraine,https://www.theguardian.com/world/2022/mar/06/flashmob-of-classical-musicians-in-trafalgar-square-play-ukrainian-national-anthem,https://i.guim.co.uk/img/media/0c20b853c4db7d2459d5e6d82f1f6c334e651530/0_371_5568_3341/master/5568.jpg?width=300&quality=85&auto=format&fit=max&s=c8b595c00dfac0f88d62dab3c205be6b
499,"Sunday, 6 March 2022",Burberry joins exodus of luxury brands from Russia,https://www.theguardian.com/fashion/2022/mar/06/burberry-joins-exodus-of-luxury-brands-from-russia,
500,"Sunday, 6 March 2022",Nicola Jennings on Vladimir Putin’s approach to peace – cartoon,https://www.theguardian.com/commentisfree/picture/2022/mar/06/nicola-jennings-on-vladimir-putins-approach-to-peace-cartoon,
501,"Sunday, 6 March 2022",‘Nowhere to go and nowhere to go back to’: Life under fire in Ukraine,https://www.theguardian.com/world/2022/mar/06/nowhere-to-go-back-to-ukraine-volnovakha,
502,"Sunday, 6 March 2022",‘Grave concern’ as Ukraine Zaporizhzhia nuclear plant under Russian orders,https://www.theguardian.com/world/2022/mar/06/ukraine-zaporizhzhia-nuclear-plant-staff-under-russian-orders,
503,"Sunday, 6 March 2022",Macron urges Putin to allow Ukraine’s besieged cities to be evacuated,https://www.theguardian.com/world/2022/mar/06/mariupol-residents-prepare-to-leave-second-ceasefire-russia-ukraine,
504,"Sunday, 6 March 2022",‘Fashion doesn’t matter now’: Balenciaga pays tribute to Ukraine’s refugees,https://www.theguardian.com/fashion/2022/mar/06/fashion-doesnt-matter-now-balenciaga-show-pays-tribute-to-ukraines-refugees,
505,"Sunday, 6 March 2022",Ukraine protests around the world – in pictures,https://www.theguardian.com/world/gallery/2022/mar/06/ukraine-protests-around-the-world-in-pictures,
506,"Sunday, 6 March 2022",‘Amazing spirit’: Yastremska donates Lyon Open prize money to Ukraine,https://www.theguardian.com/sport/2022/mar/06/tennis-ukraine-dayana-yastremska-lyon-open,
507,"Sunday, 6 March 2022",Blinken vows to escalate sanctions on Russia but warns war could last ‘some time’,https://www.theguardian.com/us-news/2022/mar/06/antony-blinken-russia-sanctions-ukraine-invasion,
508,"Sunday, 6 March 2022",Poutine not Putin: classic Quebec dish off the menu in France and Canada,https://www.theguardian.com/world/2022/mar/06/poutine-not-putin-classic-quebec-dish-under-fire-in-france,
509,"Sunday, 6 March 2022",Ukraine: footage appears to show Vinnytsia airport on fire – video,https://www.theguardian.com/world/video/2022/mar/06/ukraine-footage-appears-to-show-vinnytsia-airport-on-fire-video,
510,"Sunday, 6 March 2022","More than 4,300 people arrested at anti-war protests across Russia",https://www.theguardian.com/world/2022/mar/06/4300-people-arrested-anti-war-protests-across-russia-decounce-vladimir-putin-war-ukraine,
511,"Sunday, 6 March 2022",The conflict between a just war and peace,https://www.theguardian.com/world/2022/mar/06/the-conflict-between-a-just-war-and-peace,
512,"Sunday, 6 March 2022",US officials fly to Venezuela for talks in apparent bid to further isolate Russia,https://www.theguardian.com/world/2022/mar/06/us-officials-venezuela-talks-apparent-bid-further-isolate-russia,
513,"Sunday, 6 March 2022",Fears grow Russia could use US basketball star Brittney Griner as ‘hostage’,https://www.theguardian.com/sport/2022/mar/06/brittney-griner-arrest-russia-drugs-charges-wnba-basketball-wnba-ukraine,
514,"Sunday, 6 March 2022",Morrison decries ‘arc of autocracy’ reshaping world as he pledges to build nuclear submarine base,https://www.theguardian.com/australia-news/2022/mar/07/morrison-decries-arc-of-autocracy-reshaping-world-as-he-pledges-to-build-nuclear-submarine-base,
515,"Sunday, 6 March 2022",What Russians are being told about the war in Ukraine,https://www.theguardian.com/australia-news/audio/2022/mar/07/what-russians-are-being-told-about-the-war-in-ukraine,
516,"Sunday, 6 March 2022",Pope says invasion of Ukraine is 'not just a military operation but a war' – video,https://www.theguardian.com/world/video/2022/mar/06/pope-says-invasion-of-ukraine-is-not-just-a-military-operation-but-a-war-video,
517,"Sunday, 6 March 2022","Ukraine has fastest-growing refugee crisis since second world war, says UN",https://www.theguardian.com/world/2022/mar/06/ukraine-fastest-growing-refugee-crisis-since-second-world-war,
518,"Sunday, 6 March 2022",'Do not be silent': Zelenskiy urges Russians to protest against Ukraine invasion – video,https://www.theguardian.com/world/video/2022/mar/06/do-not-be-silent-zelenskiy-urges-russians-to-protest-against-ukraine-invasion-video,
519,"Sunday, 6 March 2022",Karim Khan: the ‘very modern British barrister’ heading ICC’s Russia inquiry,https://www.theguardian.com/world/2022/mar/06/karim-khan-british-barrister-icc-russia-war-crimes-inquiry,
520,"Sunday, 6 March 2022",Rabbi in UK wants a ‘Ukrainetransport’ for families fleeing the Russian invasion,https://www.theguardian.com/world/2022/mar/06/rabbi-in-uk-wants-a-ukrainetransport-for-families-fleeing-the-russian-invasion,
521,"Sunday, 6 March 2022","Journalists and residents run from shelling in Irpin, Ukraine – video",https://www.theguardian.com/world/video/2022/mar/06/journalists-and-refugees-run-from-shelling-in-irpin-ukraine-video,
522,"Sunday, 6 March 2022",Clear picture of war in Ukraine clouded by large areas of unknowns,https://www.theguardian.com/world/2022/mar/06/clear-picture-russian-war-ukraine-clouded-unknowns-lack-reliable-information,
523,"Sunday, 6 March 2022",Oligarch money is embedded in London. Beware the big talk of a ‘crackdown’,https://www.theguardian.com/commentisfree/2022/mar/06/oligarch-money-is-embedded-in-london-beware-the-big-talk-of-a-crackdown,
524,"Sunday, 6 March 2022",British MPs urge global banks to close Russian offices ‘without delay’,https://www.theguardian.com/business/2022/mar/06/campaigners-british-mps-banks-moral-duty-exit-russia-moscow-offices-hsbc-jp-morgan-deutsche-bank,
525,"Sunday, 6 March 2022","Here at the Polish-Ukrainian border, I see nothing but humanity towards refugees",https://www.theguardian.com/commentisfree/2022/mar/06/polish-ukrainian-border-humanity-refugees,
526,"Sunday, 6 March 2022",Brazilian politician’s sexist remarks about Ukraine refugees spark outrage,https://www.theguardian.com/world/2022/mar/06/brazilian-politician-arthur-do-val-sexist-remarks-ukraine-refugees-outrage,
527,"Sunday, 6 March 2022",Thousands join rallies around the world in solidarity with Ukraine – video,https://www.theguardian.com/world/video/2022/mar/06/thousands-join-rallies-around-the-world-in-solidarity-with-ukraine-video,
528,"Sunday, 6 March 2022",Mastercard and Visa block in Russia does not stop domestic purchases,https://www.theguardian.com/business/2022/mar/06/russians-visa-mastercard-ban-domestic-purchases-mir,
529,"Sunday, 6 March 2022",France accuses UK of ‘lack of humanity’ over Ukrainian refugees,https://www.theguardian.com/world/2022/mar/06/france-accuse-uk-lack-humanity-over-ukrainian-refugees-consular-services-calais,
530,"Sunday, 6 March 2022",Defence chief contradicts Liz Truss over idea of Britons going to fight in Ukraine,https://www.theguardian.com/uk-news/2022/mar/06/britons-ukraine-fight-defence-chief-contradicts-liz-truss,
531,"Sunday, 6 March 2022","Alexander Lukashenko has effectively ceded control to Kremlin, say opposition",https://www.theguardian.com/world/2022/mar/06/belarus-has-effectively-ceded-control-to-kremlin-says-opposition-leader-sviatlana-tsikhanouskaya,
532,"Sunday, 6 March 2022",Johnson pledges more defensive equipment for Ukraine,https://www.theguardian.com/world/2022/mar/06/ukraine-putin-dominic-raab-nato-sanctions,
533,"Sunday, 6 March 2022",'No to war': Russian TV staff walk off set after final broadcast – video,https://www.theguardian.com/world/video/2022/mar/06/no-to-war-russian-tv-staff-walk-off-set-after-final-broadcast-video,
534,"Sunday, 6 March 2022","Social media turn on Putin, the past master",https://www.theguardian.com/world/2022/mar/06/social-media-turn-on-putin-the-past-master,
535,"Sunday, 6 March 2022",Five of the best books about Russia and Ukraine,https://www.theguardian.com/books/2022/mar/06/five-of-the-best-books-about-russia-and-ukraine,
536,"Sunday, 6 March 2022",Russians at UK universities ‘lonely and guilty’ as they fear for the future,https://www.theguardian.com/education/2022/mar/06/russians-at-uk-universities-lonely-and-guilty-as-they-fear-for-the-future,
537,"Sunday, 6 March 2022","Russia’s economy is under siege, but will the west break first?",https://www.theguardian.com/business/2022/mar/06/russia-economy-sanctions-ukraine-west-cost-of-living-crisis,
538,"Sunday, 6 March 2022",Kherson diary: ‘The Russians fire a warning shot. But people are not afraid’,https://www.theguardian.com/world/2022/mar/06/kherson-diary-the-russians-fire-a-warning-shot-but-people-are-not-afraid,
539,"Sunday, 6 March 2022",Antony Blinken enters Ukraine after meeting foreign minister Dmytro Kuleba – video,https://www.theguardian.com/world/video/2022/mar/06/antony-blinken-enters-ukraine-after-meeting-foreign-minister-dmytro-kuleba-video,
540,"Sunday, 6 March 2022",The people of Ukraine need our solidarity. But not just because they’re ‘like us’,https://www.theguardian.com/commentisfree/2022/mar/06/people-of-ukraine-need-our-solidarity-not-just-because-theyre-like-us,
541,"Monday, 7 March 2022",Just 300 Ukrainian refugees granted visas to come to the UK,https://www.theguardian.com/world/2022/mar/07/ukrainians-hampered-by-bureaucracy-from-reaching-safety-in-uk,https://i.guim.co.uk/img/media/1dad2ae8a38df12093597a9db4ba729077999e0d/0_175_768_461/master/768.jpg?width=300&quality=85&auto=format&fit=max&s=40ab9882fb13401fc569bfdc7e8a56e2
542,"Monday, 7 March 2022",Democrats and Republicans agree on plan to suspend trade relations with Russia and Belarus – as it happened,https://www.theguardian.com/us-news/live/2022/mar/07/biden-us-ukraine-russia-latest-news-oil-ban,https://i.guim.co.uk/img/media/9aa875ed71adb98545285382230b37c8f5a46948/0_0_5862_3517/master/5862.jpg?width=300&quality=85&auto=format&fit=max&s=f5416b01a251cfa927e19439debce0b1
543,"Monday, 7 March 2022",‘Desperate and pleading for action’: New Zealand under pressure to help Ukraine refugees,https://www.theguardian.com/world/2022/mar/08/desperate-and-pleading-for-action-new-zealand-under-pressure-to-help-ukraine-refugees,https://i.guim.co.uk/img/media/c4a0390ce020690490095cc6ecf1ba8de8d317c0/0_165_3150_1890/master/3150.jpg?width=300&quality=85&auto=format&fit=max&s=b6cfc4c50aa1ef1e85264855965b01f2
544,"Monday, 7 March 2022",Oligarchs selling UK property to avoid new register may have to declare details,https://www.theguardian.com/uk-news/2022/mar/07/oligarchs-selling-uk-property-to-avoid-new-register-may-have-to-declare-details,https://i.guim.co.uk/img/media/e97705a1dbc2f0dff3429f32d20e0e7eebb94bf9/0_186_5568_3341/master/5568.jpg?width=300&quality=85&auto=format&fit=max&s=1fb7ac122a4172b9d79eddabfd3ef54a
545,"Monday, 7 March 2022",‘Beyond understanding’: Odesa braced to see if Putin attacks city of such resonance for Russians,https://www.theguardian.com/world/2022/mar/07/beyond-understanding-odesa-braced-to-see-if-putin-attacks-city-of-such-resonance-for-russians,
546,"Monday, 7 March 2022","Russia trying to recruit Syrians to fight in Ukraine, says Pentagon",https://www.theguardian.com/world/2022/mar/07/russia-trying-to-recruit-syrians-to-fight-in-ukraine-says-pentagon,
547,"Monday, 7 March 2022",Volodymyr Zelenskiy to address British MPs via video link on Tuesday,https://www.theguardian.com/world/2022/mar/07/volodymyr-zelenskiy-to-address-mps-via-video-link-on-tuesday-ukraine,
